<?xml version="1.0" encoding="UTF-8"?>
<schema name="mm_authority" modelName="Authority"
	xmlns="http://www.dwangel.com/dbschema" xmlns:xsi="http://www.w3.org/2001/XMLSchema-instance"
	xsi:schemaLocation="http://www.dwangel.com/dbschema dbschema.xsd"
>
	<key name="id" type="number"></key>
	<column name="type" type="int" />
	<column name="name" type="varchar" length="50" />
	<column name="locale_zh_cn" type="nvarchar" length="100" />
	<default-order-by-set>
		<order-by column="type"/>
	</default-order-by-set>
	<alias name="auth" />
</schema>